{
  "id": "liver-imaging-decision-tool",
  "title": "HNZ Liver Imaging Decision Support Tool",
  "description": "Interactive guide for selecting appropriate imaging modality and contrast",
  "startStep": "start",
  "guides": [
    {
      "id": "protocol-guide",
      "title": "Protocol Reference Guide",
      "sections": [
        {
          "title": "Pancreatic Protocol CT",
          "content": "Early arterial phase upper abdomen + portal venous phase abdomen and pelvis",
          "type": "protocol"
        },
        {
          "title": "TYPE OF MRI CONTRAST",
          "content": "Selection guidelines for MRI contrast agents",
          "type": "info",
          "items": [
            "Primovist: If there is evidence of malignancy on prior imaging",
            "Primovist: Solid/complex liver lesion",
            "Primovist: Gallbladder lesions ?malignancy",
            "Primovist: Pancreatic malignancy including high risk or large/enlarging IPMNs",
            "Dotarem or Gadovist: Question of haemangioma with no other malignancy",
            "Dotarem or Gadovist: Routine low risk IPMN follow up"
          ]
        }
      ]
    }
  ],
  "steps": {
    "start": {
      "id": "start",
      "title": "Patient Presentation",
      "question": "What is the primary clinical scenario?",
      "type": "choice",
      "options": [
        {
          "text": "Cirrhosis or risk factors for cirrhosis and no other malignancy suspected. Outside CT or US showing liver lesion",
          "variant": "primary",
          "action": {
            "type": "recommend",
            "recommendation": {
              "modality": "MRI liver",
              "contrast": "with Gadovist (in line with Auckland unless specified by MDM)",
              "notes": "Direct pathway for cirrhosis/risk factors with no other malignancy suspected"
            }
          }
        },
        {
          "text": "Patients less than 40 years old",
          "variant": "primary",
          "action": {
            "type": "navigate",
            "nextStep": "under-40-branch"
          }
        },
        {
          "text": "Patients greater than 40 years old",
          "variant": "primary",
          "action": {
            "type": "navigate",
            "nextStep": "over-40-branch"
          }
        }
      ]
    },
    "under-40-branch": {
      "id": "under-40-branch",
      "title": "Patients Less Than 40 Years Old",
      "question": "What was found on initial imaging?",
      "type": "choice",
      "options": [
        {
          "text": "Incidentally detected liver lesions on ultrasound",
          "variant": "primary",
          "action": {
            "type": "navigate",
            "nextStep": "under-40-ct-pancreas"
          }
        },
        {
          "text": "Symptoms or abnormal LFTs and ultrasound/CT confirms gallstones",
          "variant": "primary",
          "action": {
            "type": "navigate",
            "nextStep": "under-40-symptoms-decision"
          }
        }
      ]
    },
    "under-40-ct-pancreas": {
      "id": "under-40-ct-pancreas",
      "title": "CT Pancreatic Mass Protocol",
      "question": "Has the CT already been completed?",
      "type": "yes-no",
      "protocolInfo": {
        "title": "CT Pancreatic Mass Protocol",
        "description": "Early arterial phase upper abdomen + portal venous phase abdomen and pelvis",
        "note": "MRI preferred, but CT undertaken first due to MRI resource constraints"
      },
      "options": [
        {
          "text": "Yes",
          "variant": "success",
          "action": {
            "type": "navigate",
            "nextStep": "under-40-characterization"
          }
        },
        {
          "text": "No",
          "variant": "warning",
          "action": {
            "type": "recommend",
            "recommendation": {
              "modality": "CT Pancreatic Mass Protocol",
              "contrast": "Early arterial phase upper abdomen + portal venous phase abdomen and pelvis"
            }
          }
        }
      ]
    },
    "under-40-characterization": {
      "id": "under-40-characterization",
      "title": "Pancreatic CT Completed",
      "question": "Is further characterisation or assessment required?",
      "type": "yes-no",
      "options": [
        {
          "text": "Yes",
          "variant": "success",
          "action": {
            "type": "recommend",
            "recommendation": {
              "modality": "MRCP/MRI liver/pancreas",
              "contrast": "with Gadolinium (see protocol reference for contrast selection)"
            }
          }
        }
      ]
    },
    "under-40-symptoms-decision": {
      "id": "under-40-symptoms-decision",
      "title": "Patient < 40 symptoms or proven gallstones",
      "question": "?CBD stone is the only question",
      "type": "yes-no",
      "options": [
        {
          "text": "Yes",
          "variant": "success",
          "action": {
            "type": "recommend",
            "recommendation": {
              "modality": "MRCP",
              "contrast": "(CT not required)"
            }
          }
        },
        {
          "text": "No",
          "variant": "warning",
          "action": {
            "type": "navigate",
            "nextStep": "under-40-ct-check"
          }
        }
      ]
    },
    "under-40-ct-check": {
      "id": "under-40-ct-check",
      "title": "CT Pancreatic Mass Protocol",
      "question": "Has the CT already been completed and there is still diagnostic uncertainty?",
      "type": "yes-no",
      "protocolInfo": {
        "title": "CT Pancreatic Mass Protocol",
        "description": "Early arterial phase upper abdomen + portal venous phase abdomen and pelvis"
      },
      "options": [
        {
          "text": "Yes",
          "variant": "success",
          "action": {
            "type": "recommend",
            "recommendation": {
              "modality": "MRCP/MRI liver/pancreas",
              "contrast": "with Gadolinium (see protocol reference for contrast selection)"
            }
          }
        }
      ]
    },
    "over-40-branch": {
      "id": "over-40-branch",
      "title": "Patients Greater Than 40 Years Old",
      "question": "What clinical scenario applies?",
      "type": "choice",
      "options": [
        {
          "text": "Incidentally detected new/concerning liver lesions on ultrasound",
          "variant": "primary",
          "action": {
            "type": "navigate",
            "nextStep": "over-40-ct-pancreas"
          }
        },
        {
          "text": "Abdominal ultrasound for abnormal LFTs. Question is ?gallstone or pancreaticobiliary pathology",
          "variant": "primary",
          "action": {
            "type": "navigate",
            "nextStep": "over-40-ct-pancreas"
          }
        }
      ]
    },
    "over-40-ct-pancreas": {
      "id": "over-40-ct-pancreas",
      "title": "CT Pancreatic Mass Protocol",
      "question": "Has the CT already been completed?",
      "type": "yes-no",
      "protocolInfo": {
        "title": "CT Pancreatic Mass Protocol",
        "description": "Early arterial phase upper abdomen + portal venous phase abdomen and pelvis"
      },
      "options": [
        {
          "text": "Yes",
          "variant": "success",
          "action": {
            "type": "navigate",
            "nextStep": "over-40-characterization"
          }
        },
        {
          "text": "No",
          "variant": "warning",
          "action": {
            "type": "recommend",
            "recommendation": {
              "modality": "CT Pancreatic Mass Protocol",
              "contrast": "Early arterial phase upper abdomen + portal venous phase abdomen and pelvis"
            }
          }
        }
      ]
    },
    "over-40-characterization": {
      "id": "over-40-characterization",
      "title": "Pancreatic CT Completed",
      "question": "Is further characterisation or assessment required?",
      "type": "yes-no",
      "options": [
        {
          "text": "Yes",
          "variant": "success",
          "action": {
            "type": "recommend",
            "recommendation": {
              "modality": "MRCP/MRI liver/pancreas",
              "contrast": "with Gadolinium (see protocol reference for contrast selection)"
            }
          }
        }
      ]
    }
  }
}